<?xml version="1.0" encoding="UTF-8" ?>
<listado xmlns:xsi="http://www.w3.org/2001/XMLSchema-instance"
         xsi:noNamespaceSchemaLocation="EjercicioTRECE.xsd">

    <afiliado>
        <DNI>39497088Q</DNI>
        <nombre>Pepe</nombre>
        <apellidos>Perez</apellidos>
        <situacion_laboral>en_activo</situacion_laboral>
        <fecha_nacimiento>
            <dia>12</dia>
            <mes>2</mes>
            <año>1998</año>
        </fecha_nacimiento>
        <listado_bajas></listado_bajas>
        <listado_prestaciones>
            <prestacion>
                <cantidad>1564.34</cantidad>
                <inicio>
                    <dia>13</dia>
                    <mes>5</mes>
                    <año>1999</año>
                </inicio>
                <final>
                    <dia>21</dia>
                    <mes>6</mes>
                    <año>1999</año>
                </final>
            </prestacion>
        </listado_prestaciones>
    </afiliado>
    <afiliado>
        <NIE>X12564782</NIE>
        <nombre>Callum</nombre>
        <apellidos>Jones</apellidos>
        <situacion_laboral>en_paro</situacion_laboral>
        <fecha_nacimiento>
            <dia>15</dia>
            <mes>11</mes>
            <año>1997</año>
        </fecha_nacimiento>
        <listado_bajas>
            <baja>
                <causa>amigdalitis</causa>
                <fecha_inicio>
                    <dia>15</dia>
                    <mes>7</mes>
                    <año>2022</año>
                </fecha_inicio>
                <fecha_final>
                    <dia>22</dia>
                    <mes>7</mes>
                    <año>2022</año>
                </fecha_final>
            </baja>
        </listado_bajas>
        <listado_prestaciones>
            <prestacion>
                <cantidad>234</cantidad>
                <inicio>
                    <dia>23</dia>
                    <mes>4</mes>
                    <año>2002</año>
                </inicio>
                <final>
                    <dia>01</dia>
                    <mes>6</mes>
                    <año>2003</año>
                </final>
            </prestacion>
        </listado_prestaciones>
    </afiliado>
</listado>